{
  "blockers": [
    "vertical-slice human review is pending",
    "official UPLB GIS/licensing review remains pending",
    "high-resolution terrain remains pending"
  ],
  "campusWideProductionReady": false,
  "canonicalIdentityGate": "pass",
  "checks": [
    {
      "details": "canonical IDs are campus-domain IDs",
      "name": "candidate-canonical-separation",
      "status": "pass"
    },
    {
      "details": "duplicates=False providerIdentityLeaks=0 registryMismatches=0",
      "name": "persistent-identity-registry",
      "status": "pass"
    },
    {
      "details": "missingOrInvalidMaps=0",
      "name": "property-level-verification",
      "status": "pass"
    },
    {
      "details": "rejected=0 needsReview=0",
      "name": "canonical-geometry-validity",
      "status": "pass"
    },
    {
      "details": "fixtureTypes=building,walkway,waterway",
      "name": "expanded-osm-layers",
      "status": "pass"
    },
    {
      "details": "relationPolygons=1",
      "name": "osm-multipolygon-relations",
      "status": "pass"
    },
    {
      "details": "adapter and fallback use documented package entry points",
      "name": "overture-public-api",
      "status": "pass"
    },
    {
      "details": "provider is explicitly blocked/deferred; no coverage claim is made and OSM-first POC remains allowed",
      "name": "overture-comparison-status",
      "status": "pass"
    },
    {
      "details": "source:dem:srtm-baseline has a recorded usable rights status and endpoint metadata",
      "name": "dem-rights",
      "status": "pass"
    },
    {
      "details": "path=C:\\Users\\Dian\\Documents\\Vaults\\Fensalir\\uplb_roblox\\src\\Shared\\Generated\\CanonicalFeatures.lua",
      "name": "generated-luau-freshness",
      "status": "pass"
    },
    {
      "details": "two in-memory generations compare equal",
      "name": "generated-determinism",
      "status": "pass"
    },
    {
      "details": "rows=25 counts={'environmental': 2, 'hero/reference': 5, 'ordinary building': 8, 'road/intersection': 5, 'walkway/pedestrian': 5} missingHeroes=0",
      "name": "priority-review-package",
      "status": "pass"
    },
    {
      "details": "explicit accept/reject decisions with provenance are required before worldgen",
      "name": "human-review-gate",
      "status": "warning"
    },
    {
      "details": "canonical, source, registry, and review artifacts validate",
      "name": "schema-artifact-validation",
      "status": "pass"
    }
  ],
  "decision": "conditional",
  "demRightsGate": "pass",
  "discrepancies": [],
  "engineeringGate": "pass",
  "geometryGate": "pass",
  "humanReviewGate": "pending",
  "id": "validation:phase1-closure-v1",
  "inputRevisions": {
    "canonical": "data/canonical/features.geojson",
    "generated": "src/Shared/Generated/CanonicalFeatures.lua",
    "identityRegistry": "data/canonical/identity-registry.json",
    "priorityReview": "data/reviews/vertical-slice-review.json"
  },
  "measurements": {
    "canonicalCount": 3,
    "geometryStates": {
      "uplb:building:baker-hall": "valid",
      "uplb:landmark:freedom-park": "valid",
      "uplb:landmark:oblation": "valid"
    },
    "overture": {
      "comparisonGate": "blocked",
      "pinnedRelease": "2026-06-17.0",
      "status": "blocked"
    },
    "registryCount": 3,
    "reviewPackage": {
      "counts": {
        "environmental": 2,
        "hero/reference": 5,
        "ordinary building": 8,
        "road/intersection": 5,
        "walkway/pedestrian": 5
      },
      "humanReviewStatus": "pending",
      "missingRequiredHeroes": [],
      "priorityStatus": "pass",
      "rows": 25
    },
    "sourceCount": 3
  },
  "overtureComparisonGate": "blocked",
  "reproducibilityGate": "pass",
  "worldgenReady": false
}
